{
  "schemaVersion": 1,
  "repoRoot": "/workspace/project",
  "privateGitDir": "/workspace/project/.git",
  "os": "linux",
  "architecture": "x64",
  "nodeVersion": "24.15.0",
  "gitVersion": "2.43.0",
  "hostExecutable": null,
  "targetVersion": "1.0.0",
  "configHash": "aaaaaaaaaaaaaaaaaaaaaaaaaaaaaaaaaaaaaaaaaaaaaaaaaaaaaaaaaaaaaaaa"
}
